{
  "assets_manifest_path": "assets-manifest.json",
  "corpus_id": "ui-reference-events.v1",
  "corpus_sha256": "9ca2960fb8d723f95b19c012b50f8abb5e4503eedcf673fe178ed0f4afd46320",
  "fixtures": [
    {
      "coverage_tags": [
        "reference-day",
        "long-running",
        "portrait-poster",
        "ocr-protected",
        "admission-unavailable"
      ],
      "event_id": 8156,
      "extracted_at": "2026-08-21T10:41:15.462232+00:00",
      "fixture_id": "event.real.8156",
      "payload_path": "events/event.real.8156.json",
      "preview_event_sha256": "c2c4eaf7e9e88c89de7e4f510143237668073faf6dd07a36df65afa344b0518a",
      "schema_version": "ui-reference-event.v1",
      "slug": "vystavka-moy-gorod-svetlogorsk-8156",
      "source_database_snapshot_fingerprint": "5ff3be3ce417145f97b4b5c5a2d315fd820acf0ba5d222ea282523d04500adf1",
      "source_prod_id": 8156,
      "source_repository_sha": "17d3d03db763c3a537f653dce6cb806b7bf05d4a",
      "source_static_build_id": "golden-event-corpus-v1-20260821"
    },
    {
      "coverage_tags": [
        "next-day",
        "nearest-weekend",
        "landscape-crop-safe",
        "multi-image",
        "admission-price"
      ],
      "event_id": 7906,
      "extracted_at": "2026-08-21T10:41:15.462232+00:00",
      "fixture_id": "event.real.7906",
      "payload_path": "events/event.real.7906.json",
      "preview_event_sha256": "2052001842c42ac5aeaac6295cfc87a20010f6394cc16941d3386aef64579318",
      "schema_version": "ui-reference-event.v1",
      "slug": "kontsert-otkroveniya-veny-druzhba-7906",
      "source_database_snapshot_fingerprint": "5ff3be3ce417145f97b4b5c5a2d315fd820acf0ba5d222ea282523d04500adf1",
      "source_prod_id": 7906,
      "source_repository_sha": "17d3d03db763c3a537f653dce6cb806b7bf05d4a",
      "source_static_build_id": "golden-event-corpus-v1-20260821"
    },
    {
      "coverage_tags": [
        "future-45-75d",
        "portrait-poster",
        "ocr-protected",
        "multi-image",
        "admission-price"
      ],
      "event_id": 6399,
      "extracted_at": "2026-08-21T10:41:15.462232+00:00",
      "fixture_id": "event.real.6399",
      "payload_path": "events/event.real.6399.json",
      "preview_event_sha256": "4348e205747229c9bbf56d4c751e6401d58a32e837957dfdeaf0b0ae6cfbfcad",
      "schema_version": "ui-reference-event.v1",
      "slug": "eva-lilit-poeticheskiy-kontsert-marii-mezhennoy-kaliningrad-6399",
      "source_database_snapshot_fingerprint": "5ff3be3ce417145f97b4b5c5a2d315fd820acf0ba5d222ea282523d04500adf1",
      "source_prod_id": 6399,
      "source_repository_sha": "17d3d03db763c3a537f653dce6cb806b7bf05d4a",
      "source_static_build_id": "golden-event-corpus-v1-20260821"
    },
    {
      "coverage_tags": [
        "long-running",
        "ocr-protected",
        "multi-image",
        "long-copy",
        "admission-free"
      ],
      "event_id": 4327,
      "extracted_at": "2026-08-21T10:41:15.462232+00:00",
      "fixture_id": "event.real.4327",
      "payload_path": "events/event.real.4327.json",
      "preview_event_sha256": "c032e42d5fa020e587c3909e11396e1f0aafb37d28da433324bdd33c796a2734",
      "schema_version": "ui-reference-event.v1",
      "slug": "otdyha-ne-znali-iz-ruin-podnyali-kaliningrad-4327",
      "source_database_snapshot_fingerprint": "5ff3be3ce417145f97b4b5c5a2d315fd820acf0ba5d222ea282523d04500adf1",
      "source_prod_id": 4327,
      "source_repository_sha": "17d3d03db763c3a537f653dce6cb806b7bf05d4a",
      "source_static_build_id": "golden-event-corpus-v1-20260821"
    },
    {
      "coverage_tags": [
        "next-day",
        "nearest-weekend",
        "long-running",
        "no-image",
        "admission-unavailable"
      ],
      "event_id": 7888,
      "extracted_at": "2026-08-21T10:41:15.462232+00:00",
      "fixture_id": "event.real.7888",
      "payload_path": "events/event.real.7888.json",
      "preview_event_sha256": "33f66954a29394894f72d869a2a77238313f57bded7b94bb6651764d5be0fd29",
      "schema_version": "ui-reference-event.v1",
      "slug": "otkrytie-vystavki-more-vnutri-svetlogorsk-7888",
      "source_database_snapshot_fingerprint": "5ff3be3ce417145f97b4b5c5a2d315fd820acf0ba5d222ea282523d04500adf1",
      "source_prod_id": 7888,
      "source_repository_sha": "17d3d03db763c3a537f653dce6cb806b7bf05d4a",
      "source_static_build_id": "golden-event-corpus-v1-20260821"
    },
    {
      "coverage_tags": [
        "next-day",
        "nearest-weekend",
        "landscape-crop-safe",
        "long-copy",
        "admission-free"
      ],
      "event_id": 7807,
      "extracted_at": "2026-08-21T10:41:15.462232+00:00",
      "fixture_id": "event.real.7807",
      "payload_path": "events/event.real.7807.json",
      "preview_event_sha256": "ff0010eb67230f68f9c8c1d31dcdd04aeb734e04ac4287fa333afab1de2b6841",
      "schema_version": "ui-reference-event.v1",
      "slug": "prazdnichnaya-programma-ko-dnyu-gosudarstvennogo-flaga-rossiyskoy-federats-kaliningrad-7807",
      "source_database_snapshot_fingerprint": "5ff3be3ce417145f97b4b5c5a2d315fd820acf0ba5d222ea282523d04500adf1",
      "source_prod_id": 7807,
      "source_repository_sha": "17d3d03db763c3a537f653dce6cb806b7bf05d4a",
      "source_static_build_id": "golden-event-corpus-v1-20260821"
    },
    {
      "coverage_tags": [
        "future-45-75d",
        "portrait-poster",
        "ocr-protected",
        "long-copy",
        "admission-price"
      ],
      "event_id": 3132,
      "extracted_at": "2026-08-21T10:41:15.462232+00:00",
      "fixture_id": "event.real.3132",
      "payload_path": "events/event.real.3132.json",
      "preview_event_sha256": "3b722cf9514969274be612bb6341db52d0b83d2d93f322b1c9e992aeb2596818",
      "schema_version": "ui-reference-event.v1",
      "slug": "kryli-solnyy-kontsert-kaliningrad-3132",
      "source_database_snapshot_fingerprint": "5ff3be3ce417145f97b4b5c5a2d315fd820acf0ba5d222ea282523d04500adf1",
      "source_prod_id": 3132,
      "source_repository_sha": "17d3d03db763c3a537f653dce6cb806b7bf05d4a",
      "source_static_build_id": "golden-event-corpus-v1-20260821"
    },
    {
      "coverage_tags": [
        "long-running",
        "portrait-poster",
        "ocr-protected",
        "multi-image",
        "admission-unavailable"
      ],
      "event_id": 6628,
      "extracted_at": "2026-08-21T10:41:15.462232+00:00",
      "fixture_id": "event.real.6628",
      "payload_path": "events/event.real.6628.json",
      "preview_event_sha256": "3e8a3f3ffa0200933f5189cf5d8c38a509eaf156580e65a6fd01676ace499e5a",
      "schema_version": "ui-reference-event.v1",
      "slug": "togda-kaliningrad-6628",
      "source_database_snapshot_fingerprint": "5ff3be3ce417145f97b4b5c5a2d315fd820acf0ba5d222ea282523d04500adf1",
      "source_prod_id": 6628,
      "source_repository_sha": "17d3d03db763c3a537f653dce6cb806b7bf05d4a",
      "source_static_build_id": "golden-event-corpus-v1-20260821"
    }
  ],
  "immutable": true,
  "reference_clock": {
    "current_date": "2026-08-21",
    "reference_iso": "2026-08-21T09:00:00+02:00",
    "timezone": "Europe/Kaliningrad"
  },
  "schema_version": "ui-reference-event-corpus.v1",
  "source": {
    "database_snapshot_fingerprint": "5ff3be3ce417145f97b4b5c5a2d315fd820acf0ba5d222ea282523d04500adf1",
    "preview_contract": "PreviewEvent",
    "preview_export_sha256": "ed44beabb7e90278f5e6018cc2a8cc9c5ddfa2ea24c0de1bca92ef39282a8b65",
    "repository": "onedayonemasterpiece/events-bot-new",
    "repository_sha": "17d3d03db763c3a537f653dce6cb806b7bf05d4a",
    "static_build_id": "golden-event-corpus-v1-20260821"
  },
  "surface_expectations_path": "surface-expectations.json",
  "version": "v1"
}
